{
  "schema_version": "1.0",
  "job_id": "refactor-job-20260426-001",
  "flow_name": "codebase_refactor_pr_automation",
  "enabled": true,
  "repo": {
    "name": "holden-capital-agentic-workflows",
    "local_path": "/home/dank/Projects/holden-capital-agentic-workflows",
    "default_base_branch": "main"
  },
  "scan": {
    "include_globs": [
      "automation/**/*.sh",
      "automation/**/*.json",
      "docs/**/*.md"
    ],
    "exclude_globs": [
      "**/node_modules/**",
      "**/dist/**",
      "**/runtime/**"
    ],
    "max_files": 200,
    "categories": [
      "duplication",
      "complexity",
      "dead_code",
      "naming",
      "maintainability"
    ]
  },
  "policy": {
    "min_confidence": 0.9,
    "allowed_risk_levels": [
      "low"
    ],
    "max_files_changed_per_pr": 5,
    "max_lines_changed_per_pr": 200,
    "max_prs_per_run": 3,
    "allow_dependency_updates": false,
    "allow_cross_module_refactors": false
  },
  "validation": {
    "commands": [
      "npm test",
      "npm run lint"
    ]
  },
  "git": {
    "branch_prefix": "fix/refactor",
    "commit_prefix": "chore(refactor)",
    "target_base_branch": "main",
    "create_draft_pr": true
  },
  "processing": {
    "created_at": "2026-04-26T00:00:00Z",
    "queued_at": "2026-04-26T00:00:05Z",
    "processing_started_at": null,
    "processing_completed_at": null,
    "status": "queued",
    "attempt_count": 1
  }
}
